Portmoak NW,PO1,B#,Castle Keep,360,56 12.052N 003 23.521W,,"On small island 2 NMl WNW of Portmoak gliding site, for club starts and finishes",16,N,Edinburgh,31373 70179,PO1,PO1
Portmoak W,PO2,B#,Coastline,360,56 11.477N 003 20.995W,,"NE corner of large island 0.3 NMl W of Portmoak gliding site, for club starts and finishes",16,N,Edinburgh,31632 70067,PO2,PO2
Potarch Bridge,POA,A#,B993 Br over R Dee,330,57 03.905N 002 38.932W,,"6 Nml E of Aboyne, under CTA base 3000",18,W,Aberdeen,36075 79730,POA,POA
Pocklington,POC,C#,A/F R/Ws 19/31,87,53 55.559N 000 47.687W,118.685,Wolds GC site,10,E,York,47924 44843,POC,POC
Pontypool Folly,POF,D,Tower,958,51 43.008N 003 01.289W,,Top of ridge 1NMl NE of town centre,21,SW,Hereford,32953 20250,POF,POF
Pontesbury Hill,POH,A,1049 Spot Height,1049,52 38.283N 002 52.444W,,"SE of Pontesbury village, 7 Nml N of Long Mynd",6,SW,Shrewsbury,34095 30484,POH,POH
Polegate,POL,C,A22/Rail,125,50 49.276N 000 14.276E,,0.5 km W of Polegate Stn NNE side of Eastbourne,12,WSW,Hastings,55773 10480,POL,POL
Popham,POP,A,M3 J8/A303,499,51 12.063N 001 11.459W,,"Centre of bridge where A303 passes under M3, note light aircraft and microlight A/F 2 NMl to W.",6,W,Lasham,45662 14496,POP,POP
Portmoak Clubhouse,POR,C#,Clubhouse,360,56 11.328N 003 19.311W,129.98,Scottish Gliding Centre site,15,N,Edinburgh,31806 70036,POR,POR
Pocklington South,POS,C#,Leisure Centre,39,53 54.215N 000 48.882W,,Building west side Allerthorpe Lake. 3km SSW of POC.,10,ESE,York,47797 44592,POS,POS
Potton,POT,C,Aerial Mast,174,52 07.810N 000 14.514W,,Large mast 790 ft high.,7,E,Bedford,52044 24944,POT,POT
Powburn,POW,C,River/A697,49,55 26.881N 001 54.544W,,Br over R. Breamish N side of village 7 NMl WNW of Alnwick,15,S,Berwick,40585 61713,POW,POW
Pontypool E,PPE,A,Reservoir Dam W,249,51 40.903N 002 58.750W,,"W end of dam wall near tower, S of lake 1 NMl E of town.",24,SSW,Hereford,33240 19856,PPE,PPE
Pontypool N,PPN,C,Canal Bridge,335,51 43.131N 003 00.692W,,Road bridge over Brecon canal 1NMl W of A472/A4042 T junction.  At bottom of ridge that is soarable in Easterlies,22,SSW,Hereford,33022 20272,PPN,PPN
Port Appin,PPP,C,Pier House,35,56 33.277N 005 24.621W,,"On waterfront near ferry jetty, 1 NMl SW of Portnacroish",9,N,Oban,19050 74550,PPP,PPP
Park Control Point E,PR1,D,Y-junction,656,51 08.166N 002 09.717W,,"A350 junction with track NW to Summerslade Down, 3 NMl E of The Park gliding site near 781ft spot height",14,WNW,Salisbury,38877 13744,PR1,PR1
Presteigne,PRE,C,River Bridge,308,52 16.527N 003 00.189W,,"Br. over R. Lugg nr Church Tower, close to town centre on NE side of town.",16,NW,Hereford,33165 26462,PRE,PRE
Prince's Risborough,PRI,A#,Rail Junction,377,51 43.203N 000 50.676W,,"Centre of 4-way rail junction W of town, under LTMA 3500ft.5 NMl SSW Aylesbury.",13,E,Oxford,47991 20300,PRI,PRI
"Park, the",PRK,D#,Hangar,697,51 07.830N 002 14.420W,118.685,"NE side of site of Bath, Wilts & N Dorset GC, 3 NNE of Mere",15,SSE,Bath,38328 13683,PRK,PRK
Preston North,PRN,A,A6 br over rail,80,53 50.235N 002 44.364W,,N of Barton village. Avoid Warton approach traffic to S,13,S,Lancaster,35144 43814,PRN,PRN
Portree,PRT,B,Tower,70,57 24.644N 006 11.479W,,On promontary above harbour. E coast of Isle of Skye,44,SW,Ullapool,14838 84336,PRT,PRT
Pershore se,PSE,A,Road Br over River,167,52 06.243N 002 04.281W,,"B4084 bridge over River Avon, SE side of town",8,SE,Worcester,39521 24508,PSE,PSE
Portesham,PSH,B,B3157 crossroads,220,50 40.171N 002 33.879W,,S side of town 5NMl SW of Dorchester,17,SSE,Yeovil,36019 08569,PSH,PSH
Pontardulais,PTD,A,M4 J48,98,51 42.562N 004 03.615W,,M4/A4138 SW of town,6,NW,Swansea,25775 20319,PTD,PTD
Port Eynon,PTE,B,Roundabout,20,51 32.659N 004 12.617W,,S side of town near beach,11,SW,Swansea,24683 18514,PTE,PTE
Petersfield South,PTF,A,A3/Rail Bridge,246,50 59.095N 000 57.487W,,"2 NMl SSW of town. Br is over old A3, new bypass to W.",12,SSE,Lasham,47323 12113,PTF,PTF
Perth,PTH,A,M85/River Br,108,56 22.797N 003 24.527W,,N side of bridge over River Tay near railway,2,SE,Perth,31310 72174,PTH,PTH
Porthmadog,PTM,A,A487/A498,36,52 56.366N 004 08.513W,,"T junction at Tremadog N side of town, bottom of N-S ridge",50,WSW,Chester,25616 34015,PTM,PTM
Pirton,PTN,C,Crossroads,130,52 07.500N 002 10.662W,,Cross roads in centre of Pirton Village. 10k W Great Malvern,5,SSE,Worcester,38793 24742,PTN,PTN
Portsmouth Tower,PTR,A,Tower,380,50 47.735N 001 06.512W,,"558 ft high public viewing tower on waterfront, ensure safe clearance for overflight",1,W,Portsmouth,46293 09994,PTR,PTR
Petersfield West,PTW,A,A3/A272,243,51 00.496N 000 57.190W,,W Edge of Town just W of Station.,11,SSE,Lasham,47354 12373,PTW,PTW
Pevensey,PVY,A,Centre of roundabout,13,50 49.323N 000 20.555E,,A27/A259 Roundabout 1nm North of Pevensey Bay,9,WSW,Hastings,56510 10512,PVY,PVY
Penwhirn Reservoir,PWN,A,S side of Dam Wall,33,54 59.023N 004 55.506W,,By small road S side of water. Dam is on E side of water.6 NMl NE of Stranraer,45,W,Dumfries,21293 56937,PWN,PWN
Pwllheli West,PWW,A#,A497/B4415,46,52 53.749N 004 27.162W,,"T-junction 1NMl W of town centre, in south end of RAF Valley Air Tactics Area (125.225 MHz)",60,W,Shrewsbury,23511 33597,PWW,PWW
Plymouth E,PYE,A,A38/A374,60,50 23.477N 004 05.210W,,Roundabout E side of city,2,E,Plymouth,25176 05668,PYE,PYE
Pen-y-Fan,PYF,C,Trig point,2907,51 53.051N 003 26.212W,,"Highest point in S Wales, 4NMl SW of Brecon.  Caution, rugged terrain",22,NE,Swansea,30120 22160,PYF,PYF
Prestatyn S,PYS,D#,T junction,280,53 19.409N 003 23.958W,,"S of old quarry at N end of Denbigh ridge, S side of Prestatyn.  Liverpool CTA base 2000ft 2 km E",20,WNW,Chester,30689 38164,PYS,PYS
Plymouth W,PYW,A,A38/A388,164,50 25.137N 004 14.049W,,Roundabout at Saltash 1Nml W of River Tamar Bridge,4,WNW,Plymouth,24138 06006,PYW,PYW
Ramsbury,RAB,C,River Bridge,360,51 26.514N 001 36.067W,,Minor road bridge over R Kennet S side of village.  Between Hungerford and Marlborough,10,SE,Swindon,42782 17151,RAB,RAB
Radstock,RAD,A,A366/A362/B3139,433,51 16.747N 002 24.600W,,2 NMl ESE of village N of wood.,6,SSW,Bath,37150 15341,RAD,RAD
Raglan,RAG,A,A40/A449,279,51 46.025N 002 50.070W,,"E side of Town, 3 NMl N of Usk GC.",18,SSW,Hereford,34251 20793,RAG,RAG
Ramsey,RAM,C,B1040/B1096,108,52 26.906N 000 06.356W,,Centre of town.,10,SSE,Peterborough,52882 28507,RAM,RAM
Rannoch Station,RAN,A,Rail Station,968,56 41.153N 004 34.601W,,"NE end of Loch Laiden.  Caution, rugged terrain",19,ESE,Fort William,24227 75787,RAN,RAN
Ravensthorpe Reservoir,RAR,B,Bridge,351,52 20.024N 001 00.660W,,Centre of causeway over N end of reservoir N of village,7,NW,Northampton,46749 27109,RAR,RAR
Ravenglass N,RAV,A,Bridge,26,54 21.984N 003 23.735W,,A595 bridge over river Mite 1 NMl N of town at Watermill station on light railway.,27,NW,Lancaster,30942 49766,RAV,RAV
Roybridge,RBR,A,River bridge,312,56 53.443N 004 50.462W,,"Over River Roy at Roybridge, tributary of the River Spean.  3 NMl E of Spean Bridge",9,ENE,Fort William,22703 78130,RBR,RBR
Rosebush,RBS,A,B4313/B4329,815,51 56.135N 004 49.309W,,"Crossroads W of Rosebush village and reservoir, 7 NMl ESE of Fishguard.",38,WNW,Swansea,20611 23010,RBS,RBS
Rothbury,RBY,C,B6341/B6342,118,55 18.600N 001 54.610W,,T junct at village centre near church twr & br. over R. Coquet,20,NNW,Newcastle,40580 60177,RBY,RBY
Rattlesden A/F Centre,RDN,C#,Centre of Airfield,284,52 10.083N 000 51.903E,129.98,Mid-Point of Runway. Used as centre for Finish Rings.,13,NW,Ipswich,59603 25607,RDN,RDN
Radway,RDW,A,B4086 T Junction,650,52 07.863N 001 26.696W,,3 NMl NNE of Edgehill A/F where B4086 crosses Edgehill ridge,5,NNW,Banbury,43810 24823,RDW,RDW
Reading West,REA,A#,M4 J12,165,51 26.337N 001 03.939W,,"E of Theale village, N of railway & gravel pits. Under LTMA base 4500ft, base 3500ft 3 NMl to East",15,N,Lasham,46504 17152,REA,REA
Reedham,REE,C,Rail Junction Bridge,118,52 33.821N 001 34.204E,,Minor road bridge just W of rail T Junction N side of town,11,ESE,Norwich,64206 30219,REE,REE
Retford,RET,B#,A620 Bridge over Railway,66,53 19.302N 000 57.389W,,A620 Bridge over Railway. 1km NW of Retford Station. West of Retford town. Gamston ATZ to South.,15,WNW,Lincoln,46961 38104,RET,RET
Rattray Head,RHD,A,Lighthouse,98,57 36.616N 001 48.994W,,"2 NMl E of 900 ft aerial at old A/F, 7 NMl N of Peterhead",28,NNE,Aberdeen,41106 85782,RHD,RHD
Rhigos,RHI,D#,Building by footpath.,780,51 44.770N 003 34.910W,,East end of grass strip with some light aircraft activity,15,NE,Swansea,29089 20646,RHI,RHI
Rhossdhu House,RHO,D,N Side of House,49,56 04.234N 004 37.989W,,"W side of Loch Lomond, 2 NMl S of Luss between A82 & the Loch",8,NNE,Greenock,23619 68954,RHO,RHO
Rhuddlan,RHU,A,A525 Br. over river,108,53 17.484N 003 28.417W,,Dual carriageway bridge over R. Clwyd on W edge of town.  Airway 2 Nml to the North.,21,WNW,Chester,30187 37817,RHU,RHU
Rhayader,RHY,C,B4518/River Bridge,289,52 17.961N 003 30.836W,,"SW of town, Difficult landing country",32,WNW,Hereford,29686 26788,RHY,RHY
Rivar Hill North,RI2,D#,T junction,453,51 21.832N 001 33.056W,,"S side of Shalbourne village 1NMl N of Rivar Hill gliding site, avoid winch cables when active",8,WSW,Newbury,43137 16281,RI2,RI2
Richmond,RIC,A,A6136 Bridge,130,54 24.237N 001 43.848W,,Over R Swale SE side of town,35,NW,York,41757 50098,RIC,RIC
Ridgewell Church,RID,C#,Church,273,52 02.331N 000 32.121E,,"SE side of village, W of grass airfield. 17 NE Stansted.  A site of the Essex GC",18,ESE,Cambridge,57399 24086,RID,RID
Ringmer,RIN,C#,Gliding Site Hangar,72,50 54.575N 000 06.430E,129.98,NW side of field by B2192. E Sussex GC site. LTMA 3500ft 1NMl to NW,10,ENE,Brighton,54824 11435,RIN,RIN
Ripon,RIP,B,Cathedral Tower,102,54 08.105N 001 31.237W,,Near town centre,15,NW,York,43142 47113,RIP,RIP
Rivar Hill,RIV,D#,Centre of Airfield,682,51 20.500N 001 32.566W,129.98,"Centre of Shalbourne Soaring Society site, 4 NMl S of Hungerford. Alternative point RI2 clear of circuit.",9,WSW,Newbury,43195 16039,RIV,RIV
Ridgewell Field,RIW,D#,NE end of grass airstrip,273,52 02.846N 000 33.533E,118.685,"Site of Essex GC, 1.5 NMl NE of Ridgewell village",18,ESE,Cambridge,57557 24187,RIW,RIW
Rugby Northeast,RNE,A,M1 J19/M6,279,52 24.224N 001 10.592W,,Bridge over M1 where southbound lane of M6 crosses.,12,S,Leicester,45612 27873,RNE,RNE
Rhynie,RNI,C,A97/A941,492,57 19.923N 002 50.027W,,T junction S side of town E of church spire. 7 NMl S of Huntly,25,NW,Aberdeen,34990 82714,RNI,RNI
Roadford,ROA,C,Reservoir Tower,463,50 41.345N 004 14.140W,,"Tower in water, S side of reservoir and N of dam wall. Between Launceston and Okehampton",18,N,Plymouth,24218 09010,ROA,ROA
Rochester,ROC,A#!,M2 J4/ A278,417,51 20.167N 000 35.089E,,"2 NMl E of town, under TMA base 3500 ft",5,NE,Maidstone,58015 16284,ROC,ROC
Rodney's Pillar,ROD,D,Tall monument,1198,52 43.365N 003 02.709W,,"Monument to Admiral Rodney on top of soarable hill, 5 NMl NNE of Welshpool",10,W,Shrewsbury,32951 31441,ROD,ROD
Rothes,ROH,B,A941/B9015,131,57 31.890N 003 12.505W,,Y junction N side of town,12,SSE,Lossiemouth,32774 84968,ROH,ROH
Ross-on-wye,ROS,A,A40/A49/A449,141,51 54.965N 002 36.054W,,Roundabout 1 NMl W of Town,15,W,Cheltenham,35877 22434,ROS,ROS
Rotherham,ROT,A#,M18 J1/A631,135,53 25.419N 001 15.079W,,E edge of town. Avoid CTA base 2000ft 1 NMl E,8,SW,Doncaster,44985 39213,ROT,ROT
Rougham Field,ROU,C#,W end of peritrack S of Highfield Farm,184,52 14.912N 000 46.000E,123.165,N side of airfield with some light aircraft activity.  1 NMl E of Bury St Edmunds 300m S of rail line,24,E,Cambridge,58896 26475,ROU,ROU
Royston,ROY,B,Station Bridge,112,52 03.192N 000 01.586W,,"Road Bridge just E of station, N side of Town.",11,SW,Cambridge,53542 24126,ROY,ROY
Redruth SE,RSE,A,A393/B3298,180,50 12.921N 005 10.609W,,"T junction at Comford 2 NMl SE of town and 2 NMl E of tall mast, in centre of Cornish peninsula",42,WSW,Plymouth,17346 03987,RSE,RSE
Rosneath,RSN,D,Pier Land End,49,56 00.338N 004 47.629W,,W side of the Gareloch,5,NNW,Greenock,22590 68271,RSN,RSN
Rothesay,RSY,A,A844/B881,43,55 50.253N 005 03.255W,,T junction in town centre just E of castle,12,SW,Greenock,20884 66470,RSY,RSY
Rosthwaite,RTH,B,Bridge,312,54 31.549N 003 08.962W,,"Bridge over Stonethwaite Beck N of village 5 NMl S of Keswick.  Caution, rugged terrain",23,SSW,Carlisle,32571 51511,RTH,RTH
Rufforth South,RU1,D#,Pub,101,53 54.959N 001 10.524W,,"Buckle Inn N of A64,1.6 NMl S of Rufforth airfield, in line with Runway 36",4,SW,York,45426 44696,RU1,RU1
Rubha Reidh,RUB,A,Lighthouse,150,57 51.523N 005 48.704W,,On headland NW of Loch Ewe,21,W,Ullapool,17397 89184,RUB,RUB
Rufforth,RUF,C#,A/F R/Ws 29/35,65,53 57.100N 001 11.332W,129.98,"York Gliding Centre, also light aircraft traffic",4,W,York,45333 45092,RUF,RUF
Rugby,RUG,A,A426 Br over M45,262,52 20.014N 001 17.697W,,"3 NMl SW of town, NE of Draycote water.",18,SSW,Leicester,44814 27084,RUG,RUG
Ruthin NE,RUN,C,Tower,1818,53 09.267N 003 15.357W,,"Jubilee Tower, top of Moel Famau mountain 3NMl NE of Ruthin on Denbigh ridge.  Caution, rugged terrain",12,W,Chester,31611 36266,RUN,RUN
Rushden,RUS,A,A6/River Bridge,226,52 19.458N 000 35.905W,,Over River Nene 2 NMl N of Town.,12,ENE,Northampton,49562 27050,RUS,RUS
Ruthin West,RUW,B,A494 Roundabout,197,53 06.653N 003 19.226W,,West side of town,17,WSW,Chester,31171 35789,RUW,RUW
Ruthven,RVN,D,Ruins,780,57 04.320N 004 02.360W,,"Ruins of old military barracks 1 NML SE of Kingussie, used as a descent point after high level wave flights with the intention of being clear of high ground",25,SSW,Inverness,27646 79973,RVN,RVN
Rutland Water Dam,RWD,A#,Dam,281,52 39.837N 000 36.730W,,"NW end of dam wall, E side of lake. Shacklewell Lodge airstrip to SE.",19,E,Leicester,49396 30826,RWD,RWD
Rydal Bridge,RYB,C,Bridge,220,54 26.910N 003 00.414W,,"Small bridge over river at W end of Rydal Water and E of Grasmere, 2NMl NW of Ambleside.  Caution, rugged terrain",26,S,Carlisle,33481 50637,RYB,RYB
Ryde,RYD,B,Roundabout,10,50 43.886N 001 09.374W,,A3055 on sea front over railway line,6,SSW,Portsmouth,45963 09277,RYD,RYD
Rye,RYE,B,River/Rail Bridge,33,50 57.323N 000 44.327E,,"Rail Br over River Rother, NE side of town",8,NE,Hastings,59245 12090,RYE,RYE
Sackville,SAC,D#,Gliding Site,250,52 15.867N 000 29.090W,135.48,"Sackville GC site, 2 NMl North of Bedford airfield.",8,N,Bedford,50350 26400,SAC,SAC
Salisbury Cathedral,SAL,A,Tall Spire,151,51 03.885N 001 47.839W,,"404 ft spire, S of city centre between city and river Avon. Boscombe Down & Old Sarum traffic to the North.",0.2,S,Salisbury,41430 12951,SAL,SAL
Sandhill Farm,SAN,D#,Gliding Site Hangar,350,51 36.234N 001 40.591W,129.98,"Vale of White Horse GC site, 0.5 NMl NW of Shrivenham.",4,NE,Swindon,42250 18950,SAN,SAN
Shap,SAP,A,A6/Rail,880,54 32.111N 002 40.730W,,"A6 bridge over rail, N of village 8 NMl SSE of Penrith",23,SSE,Carlisle,35617 51576,SAP,SAP
Sarnesfield,SAR,C,A4112/A480,312,52 09.092N 002 55.227W,,"E of 2 T juncts on SW side of village, 6 NMl S of Shobdon A/F",10,NW,Hereford,33712 25076,SAR,SAR
Salisbury South,SAS,C,Bridge over River Avon,322,51 02.348N 001 45.364W,,"Just E of Longford Castle, 1 NMl WSW of the VRP at Alderbury. Avoids Boscombe & Old Sarum traffic.",3,S,Salisbury,41720 12667,SAS,SAS
Sandwich,SAW,A,A256/A257 R'bout,240,51 16.763N 001 19.290E,,"WNW edge of town, S of railway. A257 goes to Ash",9,E,Canterbury,63174 15860,SAW,SAW
Saxthorpe,SAX,C,B1149/B1354,135,52 49.825N 001 08.350E,,Village centre near church tower,13,NNW,Norwich,61157 33049,SAX,SAX
Saltby NW,SB2,B,Croxton Kerrial village T junction E,490,52 51.208N 000 45.463W,,E of two T-junctions in village. Just E of spot height 518 ft. 2.5 Nml NW of Saltby airfield,6,SW,Grantham,48375 32916,SB2,SB2
Strubby,SBB,C#,R/Ws 26/32,47,53 18.457N 000 10.043E,129.98,Lincolnshire GC site,25,E,Lincoln,54451 38115,SBB,SBB
Santon Bridge,SBR,C#,Bridge,85,54 24.119N 003 22.332W,,Bridge over river Irt in Santon Bridge village between Wast Water and Ravenglass.  Avoid Seascale restricted area to W,28,NW,Lancaster,31102 50159,SBR,SBR
Simonsbath,SBT,D,Church,1133,51 08.459N 003 45.103W,,"Church, East side of village.",26,NNW,Exeter,27755 13943,SBT,SBT
Saltby,SBY,A#,R/W Triangle,480,52 49.718N 000 42.860W,129.98,"Centre of 3 runways at Buckminster GC site. Glider aerobatics carried out over airfield 1000 to 4000 feet.  Alternative points SXB, SB2, BVR, GRA.",6,SW,Grantham,48672 32645,SBY,SBY
Scarborough,SCB,A,Lighthouse,131,54 16.916N 000 23.351W,,S side of promontary E side of town S of castle,30,NE,York,50497 48856,SCB,SCB
Scalford Church,SCF,C,Church Tower,379,52 48.558N 000 52.183W,,Church Tower in centre of Village.,14,NE,Leicester,47629 32412,SCF,SCF
Scoulton,SCL,C,T Junct SE of Lake,167,52 34.284N 000 56.141E,,"Lake with island, 2 NMl E of Watton disused A/F.",13,WSW,Norwich,59904 30111,SCL,SCL
Strathcarron,SCN,A,Rail br over A890,50,57 25.341N 005 25.736W,,SW side of village,30,SSW,Ullapool,19421 84208,SCN,SCN
Scourie,SCO,A,A894 T junction,20,58 21.089N 005 09.314W,,"In village centre S of harbour.  Caution, rugged terrain",27,N,Ullapool,21546 94466,SCO,SCO
St Catherine's Point,SCP,A,Lighthouse,30,50 34.530N 001 17.910W,,Most S point on Isle of Wight,14,SSW,Portsmouth,44977 07532,SCP,SCP
Scunthorpe N,SCU,B#,A1077/B1430,131,53 36.256N 000 39.166W,,Roundabout T junction N side of town.  CTA 3 NMl to W,16,ENE,Doncaster,48924 41281,SCU,SCU
St Davids,SDV,B,Cathedral Tower,164,51 52.902N 005 16.133W,,"West side of town, 12 NMl WNW of Haverfordwest",49,WNW,Swansea,17512 22540,SDV,SDV
Seighford South-West,SDW,C,Tower,389,52 48.948N 002 14.488W,,Tower of Abbey Ruin adjacent to triangular lake 2km WSW Seighford Airfield),19,ENE,Shrewsbury,38382 32428,SDW,SDW
Seighford Hangar,SE2,C#!,SE side of club hangar,321,52 49.666N 002 12.553W,129.98,"Staffordshire GC 3 NMl WNW of Stafford. Active Airfield, use new point SDW (Seighford South-West) instead.",20,ENE,Shrewsbury,38600 32560,SE2,SE2
Seaford East,SEA,A,A259 river Bridge,15,50 46.395N 000 08.760E,,Bridge over river Cuckmere 1 Nml E of outskirts of town on W side of flood plain,11,ESE,Brighton,55141 09927,SEA,SEA
Sedbergh,SED,B,A684/River,39,54 19.476N 002 34.066W,,Bridge W side of village. Few landable fields,18,NNE,Lancaster,36317 49226,SED,SED
Selset Reservoir,SEL,A,Dam wall north end,1050,54 35.362N 002 07.649W,,"At water course to E to next dam, 3 NMl S of Middleton-in-Teesdale",32,SW,Newcastle,39186 52158,SEL,SEL
Sennybridge,SEN,C,A40/A4067,625,51 57.002N 003 33.717W,,Centre of Grass Triangle at Junction on E side of village 6NMl W of Brecon. Difficult landing country.,33,WSW,Hereford,29275 22910,SEN,SEN
Settle,SET,A,Rail Br over A65,75,54 03.008N 002 17.162W,,1 NMl S of town just E of A65 roundabout. SW of 2200 ft ridge,18,E,Lancaster,38137 46161,SET,SET
Severn Bridge N,SEV,B,East End Tolls,243,51 36.204N 002 37.371W,,North of two bridges. Sea air in Westerlies.,16,NW,Bath,35696 18958,SEV,SEV
Sheffield West,SEW,B,Dam wall,1076,53 21.941N 001 35.743W,,"E end of 3 Redmires dams on high ground W side of Sheffield, 1 NMl N of 1500ft spot height",21,SW,Doncaster,42700 38550,SEW,SEW
Stamford Bridge,SFB,A,A166/River Bridge,62,53 59.473N 000 55.005W,,Bridge over river Derwent NW side of village,6,ENE,York,47112 45556,SFB,SFB
Sleaford,SFD,A,Rail/Rail Bridge,207,52 59.626N 000 23.301W,,"Br where N/S line crosses over E/W line. 1 NMl E of town, N of small lake. Avoid traffic at Cranwell and Barkston A/Fs",11,NE,Grantham,50827 34526,SFD,SFD
Sheffield East,SFE,A#,M1 J31/A57,174,53 21.731N 001 17.010W,,"6 NMl E of city, 2 NMl W of Aston village. Avoid CTA base 2000 ft 2 NMl to E.",9,SW,Doncaster,44778 38527,SFE,SFE
Stratford West,SFW,A,Road Bridge over R Avon,148,52 10.548N 001 47.380W,,"N side of Welford village, 2.5 NMl WSW of Stratford.  Used as a run-in point for Bidford comps",17,NW,Banbury,41448 25308,SFW,SFW
Stelling Windmill,SGW,D,Windmill,476,51 10.640N 001 04.156E,,S side of Stelling Minnis village 0.5 NMl E of B2068,6,S,Canterbury,61463 14649,SGW,SGW
Shobdon NW,SH2,D##,B4362 crossroads,475,52 15.681N 002 55.530W,,"Junction of B4362 and road to N to Byton, 2 NMl NW of airfield with ATZ, also site of Herefordshire GC.  This point is for the use of the GC as a remote start/finish point clear of the airfield itself",14,NW,Hereford,33693 26298,SH2,SH2
Shobdon E,SH3,D,Crossroads,290,52 16.265N 002 46.822W,,Bicton village,12,N,Hereford,34685 26395,SH3,SH3
Shobdon West,SH4,D,Y junction,250,52 14.450N 002 58.490W,,"on B4355, 500m north of Titley church",15,NW,Hereford,33353 26074,SH4,SH4
Shaftesbury,SHA,A,A30/A350 R'bout,650,51 00.120N 002 11.079W,,SE side of town.,14,WSW,Salisbury,38714 12253,SHA,SHA
Sherborne,SHB,A#!,Station/A352 Bridge,161,50 56.428N 002 31.244W,,"A352 Br over railway 1 km W of station, S side of town. Look for and avoid ILS and other traffic into Yeovil.",5,E,Yeovil,36351 11580,SHB,SHB
Stoer Head,SHD,B,Lighthouse,92,58 14.402N 005 24.162W,,"7 NMl NW of Lochinver.  Caution, rugged terrain",22,NNW,Ullapool,20036 93297,SHD,SHD
Sheffield North,SHE,A,M1 J35/A629,135,53 27.354N 001 26.728W,,"W side of Chapeltown village, 4 NMl N of Sheffield.",14,WSW,Doncaster,43692 39560,SHE,SHE
Shirebrook Station,SHI,A,Rail Station,223,53 12.198N 001 12.170W,,S side of triple rail junction W side of town 5 NMl N of Mansfield,24,W,Lincoln,45335 36766,SHI,SHI
Salt Hill Mast,SHL,D,Mast near 768ft high point,240,50 58.409N 001 02.425W,,"2 NMl W of 886ft spot height (Butser Hill), 4 NMl SW of Petersfield, near Hang Glider launch site on 1:500,000 map. TP is intended for South Downs ridge running.  Solent CTA 1.5 NMl to the West.",13,S,Lasham,46747 11978,SHL,SHL
Shepton Mallett,SHM,C,A361/A37,489,51 11.261N 002 32.166W,,E of Town Centre.,13,SSW,Bath,36263 14330,SHM,SHM
Shobdon,SHO,A##,E end of single R/W,328,52 14.524N 002 52.466W,118.155,"Airfield with ATZ, with light aircraft and microlights.  Herefordshire GC site. Alternative TPs avoiding ATZ are SH3 and SH4.  Always call before penetrating ATZ.",13,NNW,Hereford,34039 26079,SHO,SHO
Shipston-on-stour,SHP,A,A3400/A429,171,52 05.831N 001 37.742W,,2 NMl N of vill. on Fosse Way NNE of Moreton-in-Marsh.,10,W,Banbury,42551 24438,SHP,SHP
Shrewsbury,SHS,B,River Severn/Rail Br,171,52 42.626N 002 44.882W,,"City centre, near station.",0,N/A,Shrewsbury,34956 31279,SHS,SHS
Shottaton,SHT,C,Cross-Roads,303,52 47.911N 002 57.028W,,Junction of the A5 and B4397. 2nm E of Knockin. 5nm SE of Oswestry.,9,NW,Shrewsbury,33601 32275,SHT,SHT
Shrivenham N,SHV,B,A420/B4508 R'bt,335,51 36.934N 001 38.195W,,N side of village and Royal College of Military Science/Staff College complex. 1.5 NMl ENE of site of White Horse GC at Sandhill Farm.,1.5,ENE,Swindon,42526 19081,SHV,SHV
Shrewsbury NW,SHW,D,Shelton water tower,272,52 42.986N 002 47.624W,,300m N of A458/B4380 junction,2,NNW,Shrewsbury,34648 31349,SHW,SHW
Shawbury,SHY,A##!,Runway Intersection 18/36 & 05/23,240,52 47.876N 002 40.080W,133.15,RAF Shawbury Gliding Club at Active Air Force Station with ATZ.,44,W,Derby,35506 32247,SHY,SHY
Sidmouth,SID,B,River Bridge,30,50 40.745N 003 14.054W,,Bridge for SouthWest Coast Path over river Sid close to beach.,10,E,Exeter,31289 08733,SID,SID
Silverstone,SIL,C#,R/W 24 E end /Racetrack,502,52 04.376N 001 00.496W,,"East side of race track just N of long shed. Avoid helicopter activity, particularly on race days. Not suitable for Landing.",12,SSW,Northampton,46807 24208,SIL,SIL
Stirling South,SIS,A#,M9 J9/A872,118,56 04.651N 003 55.216W,,Mid point of M9 as it passes under 2 bridges at large roundabout at Bannockburn. TMA base 2500 ft,2,S,Stirling,28058 68885,SIS,SIS
Sittingbourne,SIT,A,M2 J5/ A249,407,51 19.770N 000 39.804E,,3 NMl WSW of town,7,NE,Maidstone,58565 16230,SIT,SIT
Stirling Northwest,SIW,A,A84 bridge over M9at Junction 10,105,56 08.070N 003 58.273W,,"Close to river Forth 1 NMl NW of Castle on rock. TMA 1.5 NMl to the S, base 2500 ft",2,NW,Stirling,27759 69528,SIW,SIW
Sixpenny Handley,SIX,A,A354/B3081,390,50 56.946N 001 59.160W,,R'bout 1 NMl SE of village.,6,SW,Salisbury,40108 11663,SIX,SIX
Stickney Bridge,SKB,A,Bridge,10,53 04.022N 000 00.929E,,A16 bridge over dyke 1 NMl S of village,21,ESE,Lincoln,53514 35410,SKB,SKB
Skeffington,SKE,C,A47/B6047,384,52 37.155N 000 55.336W,,"E of 2 T junctions 100 m apart, 1 NMl W of Village.",7,E,Leicester,47306 30293,SKE,SKE
Skelling Farm,SKF,D,Flying field,597,54 41.876N 002 35.002W,129.98,"6 NMl ENE of Penrith at bottom of Cross Fell ridge, site of Edensoaring club",17,SE,Carlisle,36250 53381,SKF,SKF
Stocks Reservoir South West,SKS,A,Tower near dam wall SW corner of water,625,53 59.208N 002 25.728W,,7 Nml N of Clitheroe,12,ESE,Lancaster,37198 45461,SKS,SKS
Selkirk W,SKW,A,A708/B7039,492,55 32.628N 002 54.020W,,T Junction 2 NMl W of town at B7039 bridge over Yarrow Water,28,SE,Edinburgh,34328 62816,SKW,SKW
Sleap,SLE,C##,A/F R/Ws 23/36,275,52 50.072N 002 46.221W,122.455,Airfield with ATZ and light aircraft activity.  Site of Shropshire Soaring Group.,10,N,Shrewsbury,34820 32661,SLE,SLE
Silloth,SLL,B,B5300/B5301,23,54 51.618N 003 23.085W,,T-junction S side of village,15,W,Carlisle,31121 55260,SLL,SLL
Selsey Bill,SLS,B,Lifeboat station,30,50 43.634N 000 46.732W,,E side of town,12,ESE,Portsmouth,48629 09267,SLS,SLS
Smailholm Tower,SMA,D,Tower on hill,680,55 36.256N 002 34.559W,,"Stone tower 1 Nml SW of Smailholm village, 5 NMl W of Kelso",21,SW,Berwick,36381 63467,SMA,SMA
Six Mile Bottom,SMB,A#!,A11/Rail Br,98,52 11.147N 000 17.936E,,"Dual carriageway bridge over railway, SW of village. Within Cambridge RAZ.",6,E,Cambridge,55726 25666,SMB,SMB
St Mary's Loch,SML,A,A708/River Br,30,55 29.541N 003 12.283W,,"Over Megget Water joining a Reservoir to the Loch, NE side of loch at Cappercleugh, 9 NMl S of Peebles",26,S,Edinburgh,32398 62272,SML,SML
St Michael's Mount,SMM,A,Centre Tower,175,50 06.990N 005 28.689W,,Benedictine Priory on Island 0.45nm SSE of Mainland at Marazion. Replacement for Penzance North. RMZ to West.,54,WSW,Plymouth,15145 02984,SMM,SMM
